0	なんか来て気分向けば返信してる。基本的にスルー
1	モノが良いというのとセンスがあるというのはまったく別次元の話
0	これに関しては思うところがあるのだがまあいらんことは言わんとこう
1	中華料理食いに来た。中国人の方いっぱいいる街なので中華料理店多い
0	中華料理デートはよ
1	コース料理食べた。中華もまあうまかった http://t.co/4EA55bC3GO http://t.co/asreAQ0xZO http://t.co/69agUtFGg3
0	人と同じやり方じゃ差が縮まらんよなあ
-1	RT @umauma2010: 自転車乗りながらフォワ賞ゴール前のスミヨンの真似してたら後ろに高校生いて気まずくなった
0	高低差200mの坂登って来たったwww http://t.co/rkh5uxOAS5
0	あたし土着のヤンキーだけど、ひとりでマックシェイク飲んでる
0	キチガイみたいなこと言うのやめよう
1	童顔好きとかではないので
0	最近女子大生を「どうせビッチなんだろ」という視点からしか見れなくなってしまっており、本当に申し訳なく思う
0	全員が全員そうではないはずだが
-1	ヤンキーモテすぎわろたwww ヤンキー＞＞＞＞＞＞＞＞＞キモオタが残念ながら確定
0	やることないのでTwitter厨になってる
0	@icchinakka なんや→www
0	実家帰って来たけどチャリ乗る以外特に何もしてない
0	誰かごはん行こうじぇ///
0	@ooopsps @popopo2525meen おっても日曜までやなあ
0	@zemityo_abe 日曜か土曜まで
-1	チャリに買いに行くので付き添い行ってきた。整備士の方の技術を盗もうと思ったがなかなか難しい
0	回転寿司来たが、注文しすぎて注文受付一時ストップされてわろたwww
0	やっぱ相武紗季みたいな感じやなあ
1	馬も女の子もそうであるが、理想形よりも少しミスあるのが良いよなあ
1	服のセンスよろしくないとかそういうの
0	私の最大の欠点は個性がないところ
0	暇になった
0	電話してもよかったのだがめんどくさいとか思ってみたのでやめとこう
0	電話の履歴がほとんど母親か父親じゃねーか。しかもかかってきたのばっか
-1	自分から電話したりするのはめんどくせえというか邪魔くさいというかなんかそう思ってしまうよなあ
0	まあそもそも相手方にご迷惑がかかる点が気がかり
0	とりあえず布団に吸い込まれるごっこの続きするかあ…
0	布団に吸い込まれる感じで右手を伸ばして苦しみながら「うわああああああ」とかうめき声あげるのがポイント
0	おまえの服装とか行動「うぇーいwww」じゃね？とこの前言われたことが印象に残ってる
0	ひとりでミスド厨
0	間違えた
0	ひとりでミスド中
1	聞き取り調査行くときは首から学生証でもぶら下げといた方が良いなあ
0	ミスドビッツ売れすぎわろた
0	iOS7にしとくかあ
0	車止まったので車押してる。軽四ならひとりで押せるなあ
0	ポタリング行こうと思ったら芝刈りしろと言われた
-1	先ほどは車を押さされるし私も大変
0	@ayachan522 一緒にマリカーしてくれば(適当)
0	服着替えて自転車の点検したしポタリングしてこよう
0	まあ20キロぐらいにしとこう。暑いし
-1	これって恋かなみたいなことねえなあ。私感情薄いし
1	だいしゅきみたいなこと言ってもいいがまあそういうキャラクターではないのでやめとこう
-1	車押したり芝刈りしたりと今日はハードな日だなあ
-1	私のことを「難しい人」と表現する人いるが、そもそも扱ってほしいとお願いはした覚えがない
0	ios7にアップデートした
1	喫茶店でおじさんに良いポタリングコース教えてもらったので今から行ってくる。日が沈むまでには帰って来たい
0	ポタリングなう http://t.co/nQ2p6bNgqW
0	街灯も民家もない山奥で足つった時はもう逝ったと思った
0	@shiotanumauma チャーリー
0	53キロ完走しました！ビールうますぎわろた http://t.co/7OuBS5052H
1	コースの高度変化がよくわかる図 http://t.co/5FThfIlcQj
0	@shiotanumauma 登りすぎわろすwwwとか思ったやろwww
0	@shiotanumauma ああそんなに会いたいんか。まったくやな(適当)
0	@shiotanumauma 俺基本的に誰かに会いたいとか思わんしなあ。あやちゃんとかみたいな一部例外は除くが
0	@shiotanumauma そういう関係ではないよ。最近絡んでねーし
0	俺氏がチャラいと話題に
1	@shiotanumauma たぶん彼女は私のことどうでもよいと思うよ(棒読)
0	@shiotanumauma まあ私がつれるお姉ちゃんとかいねーだろ
0	@shiotanumauma そもそもちゃんねーとの絡みないし。まあ釣りたい相手もかなり限定されるが
-1	iOS7そこまで悪くはないと思うよ
0	リスクは冒すものだと思ってる
0	昨日は外で七輪使って秋刀魚焼いてた
0	@umauma2010 はよう
1	←ワイルド系非リア
0	アップデート厨
0	かつ丼食う
0	詐欺っぽい電話かかってきた。暇なので相手してる
-1	ググったらやっぱり悪質詐欺情報会社でわろた。おまえらが俺の予想に乗っかっとけよwww
0	20km完走した http://t.co/uG1raKhbVH
0	やることないので暇すぎわろたwwwと騒いでいる
0	陸の孤島のようなところに隔離されているしなあ。車はあるが、また止まって押すとかなるとめんどいので乗らないよっと
0	私のロードバイクはすでに京都へ向けて出発したし私の交通手段は今んとこ徒歩だけということになる
0	大阪である凱旋門賞のパブリックビューイング1000円やし行こっと。とりあえず明日チケット買いに行くけど誰か一緒に行かね？
1	私のこと金回りが良いという人いるがそんなに良くないよっと。計画経済の賜物
0	私が卒業した高校の数学のじいさん先生が何歳かで議論が紛糾している
1	ちなみにまだ現役らしい。正直80歳は超えてそうだが。誰か何歳か教えてよ。というか何歳やと思うか？
0	実家生活やのに母親飲み会行ったおかげで私と妹の2人分の自炊せんといかんとかもう
0	iPhone5C買うかあ
1	妹が学校で頭がわいとる奴の話しよる。私とかも私の知らないところでいろんな人に頭わいとるとか言われよんやろなあ。これは光栄
0	夏も終わるし寒くなってくから心を温めてくれる彼女を作ろう←おもしろいこと
1	妹の担任は遠距離恋愛の彼女にフラれたらしく、尋常じゃないぐらい落ち込んでるらしい
-1	浮き沈みのある人生は大変ですなあ。良くも悪くも私なんて気楽なもんですよ
-1	わいも相手おらんなあ。残念ながら
-1	人望はないし素行は悪いし私は今後どうしていこうか
0	彼女いない歴＝年齢とかいうガチホモ←わい
0	おはようござんす
0	凱旋門賞のパブリックビューイングチケット買えました http://t.co/6jwUoTuC7u
0	まあ私なんてたいしたことはない
0	人を愛すとかいう罰ゲーム
0	この夏は反省文書いて反省しないといけないぐらいなレベル
0	暇なのでふてくされてる
0	ちょっと焼肉行ってくる
-1	焼肉デートとか悪くなさそう
1	@morenaku_ore というより愛媛ってかわいい子多いよね。まあ関係ないけど
1	@_reddhi @morenaku_ore 白って女の子大好きっぽいよな。わいとか女の子と話す機会すらもあらへんで(棒読)
1	@_reddhi @morenaku_ore いやあ、もう1ヶ月は女の子と話してないよ。なんか絡んでないと好きというか、意識すらもせんよなあ
1	【悲報】俺氏、奇行が多いと言われ叩かれる
1	焼肉屋のお姉ちゃんかわいいなあとか思ってたが、昔の知り合いと判明し声かけなくてよかったなあと思いました
-1	うかつにちゃらんぽらんなこともできません
0	人生とか基本的にすれ違いみたいなもんですよ
-1	まあ難しさはあるよね
0	本質とは何なのか
0	寝るか
0	最近疲れすぎて頭がさらにおかしくなっている
1	西条って新チームになってから強豪校相手にも関わらず、練習試合1敗で切り抜けたとか聞いてたが本当に強かったんだなあ
0	やることねえ
-1	明日はスーツの時に着るシャツ買いに行くかあ。街遠いが
-1	いかんなあ。2週間ぐらいずっと毎日誰かと話してたので今日は急に暇な感じがするなあ
0	まあこれは甘え。またこの生活にもすぐ慣れる
-1	就職すると女の子少ないらしいから彼女作るの無理ゲーだなあ。まあ大学でも無理やったけどね(棒読)
0	「そもそもおまえは彼女作る気ないやろ」←このようなことを結構言われるのだが
0	そういえば8万円ぐらいお金立て替えとったのを今思い出した
0	空腹に耐えてる。減量
0	はよう
0	仕方なくスケジュール帳買った
0	管理するほどスケジュールねーよ
-1	今日は朝からお出かけしてたので忙しかった。なんか微妙なもの買ってお金使うのはつらいなあっと
0	横になると眠たくなった。まあ寝ている場合ではない
0	そういえば自転車が愛媛県から帰還した
1	ポタリングのときはこういうとこ走った。風強かった http://t.co/B4wFWCCUEw
0	まあたお姉ちゃんからFacebookの申請来とるが(棒読)
0	RT @2chkeibanews: 岡田総帥「プレイアンドリアルは生涯最高の馬」　http://t.co/xzZgLBbjpC #keiba　#jra　
1	私が見た中で生涯最高の馬は馬体だけならワンアンドオンリー。まだ未勝利の身だが、良いところまで行けると思う
0	高校のときは恵まれた環境だったんだなあと思うね
0	まあこんなことを言っているうちは話にならんけどね。過去を振り返るとか基本的には意味ないから。まあたまには意味あるけどね
1	安心と信頼のぼっち飯
0	卒論書くために論文読み始めた。だいぶん出遅れ感あるが
0	今日のFacebook上でのリア充の溢れぐあいが過去最高な件
1	もはや対応できんが、まあどうでもよい
0	泥酔して新千歳で高い蟹買っちゃった俺って超リア充
1	@ayachan522 懐中電灯的なのが標準装備されたのよろしいやん。あれめっちゃ使える
0	まあリア充など私の敵ではない。住んでる世界違うから(震え声)
0	@ayachan522 画面の下から上向いてシュってやると出てくるだなあ、これが
0	@ayachan522 まだまだアナログちゃんやなあ…ふっ
0	まあターンオーバーで問題ないだろこの程度
0	そういやこの前朝起きたらLINEの通知が50とかになってたがもちろん見てない
0	未読要約サービスはよ
1	LINEとか使いこなせてない私も十分アナログかあ。まああんなもんはとりあえず送れれば問題ない
0	しかしいろいろやべえなあ
0	@ayachan522 とりあえずロック画面はどこをシュッてしても解除できる。あとは画面の適当なとこで上から下にシュッてしたらspotlight検索できるよっと
1	今日のわいはやたら親切丁寧
-1	@ayachan522 前は1番左に画面シュッてしよったらできよったよなあ。まあ総じてiOS7はそんなに悪くない気がするが、いかんせんデザインがなんか女性向けな気がせんでもない
-1	@ayachan522 なんか妙にポップなんよなあ。わいの好みとちょっと合ってないがなって言いたい。笑
0	LINEがビデオ通話に対応しましたって絶対使わんなあこれ
0	Skypeのやつすらも使ってないのに
0	@ayachan522 使おうにも使う人おらんよね。LINEとかチキンラーメンのひよこちゃんにスタンプ送りまくるぐらいしかやってねーわ
0	いや、アプリのアップデートさせてよっと
0	そういやLINEのひよこちゃんスタンプがもらえるシリアルナンバー3つぐらい持ってるから誰かにあげよっかなあと思ってみたり
0	夏休みで40万円近くお金増えたなあ。まあ使ったお金もまあまあやけど、そんなにまでもは使ってないしなあ
1	というか深夜の時給って1000円余裕で超えるんか。よろしいやん
0	なんか急速に体調悪なってきたが
-1	厳しいなあっと
1	私的には明智光秀みたいな姿を見たいよなあ。下剋上こそ至高
0	暇になった
0	LINE既読厨はさっさとパソコンでLINEすべき
0	RT @umauma2010: 同窓会の出席って今はLINEでするものなんですね。往復はがきが来て返信するといった手法だと思ってたんだが、逆にこれだとLINEやっていないほうがなんか申し訳なく思ってくるなあ。やらないけど
0	そういや同窓会出席するとLINE送ってなかったの思い出した。これはファインプレー
0	迅速に送っておいた。しかし立食パーティーとかしんどいし折りたたみイスでも持って行こうかなあ
0	さすがはキチガイ。発想が一般人とは異なる
0	バラの花でも咥えて行ってちゃんねー捕まえるかなあ
-1	隣人のうぇーいｗｗｗとその友達が大騒ぎしてる。ひとりではなかなか厳しいが私も対抗して大騒ぎする
0	とりあえずタラのムニエル作って食べてる
0	しかし今はむしょうに鶏肉の香草焼きが食べたい
1	大学とかリア充が溢れかえってるもの。絵に描いたようなキモオタの私はおとなしくしてるのみ
0	私のイメージは大学にいる「こいつイケてないなあ」という人を想像したのでおそらく間違いないと思います
1	正直、女子力って重視される要素なのかなあ。あんまいらんくねとか思うが、世論はわからん
0	誕生日にバリ行くってどこの富豪や
0	わいなんか誕生日特に祝福されることなく、バイトに行き淡々と作業をこなし、家帰ってひとりでケーキ食べてるというのに
0	寝れんなあ。困った
1	普段全然連絡よこさんくせにたまになんか頼って連絡してくる人とか結構好きやなあ
1	普段は私に興味関心がないという点が実に良い
0	おはよう
0	@ayachan522 うちの母親もたいがい意味わからんけど、これはなかなかｗ
0	ボス猿逃げたらしいな(適当)
1	@ayachan522 いやあ、まあわざわざメールしてくるとか母親に愛されとんやなあ。よろしいやん
0	@ayachan522 あれはもうなんか、慣れるやろって感じで割り切っとる。笑
1	自分でアイスコーヒー淹れるよりもセブンイレブンの氷のやつ買った方がおいしい
-1	1.2倍速で対応できれば言うことないが難しい。まあ要は慣れやね。標準速度が楽になるだろ
-1	スケジュール帳書くのやっぱりめんどくせえなあ
0	@zemityo_abe おまえもすっかりタンブラーコレクターやな
1	Evernoteアップデートしとるけどよろしいやん
-1	めんどくせえ
1	LINEのノートって何？今日はじめて気づいた。えらい人教えて
0	RT @umauma2010: 基本的に何を言われても笑顔で応対するが、「LINEやろう！」てめえはだめだ
0	余裕がなさすぎてもう
-1	非常につらい
0	夜は感情的になりすぎて何もはかどらん
-1	モテるコーディネートとか書いてるが、服装はもちろん私の場合は人間性から叩き直さねば無理だろう
0	@icchinakka いみふ
0	そういや今日から学校始まったらしいね。バイト行って違う大学の女の子に「今日から学校始まったんでしょ。ちゃんと行きました？」とか言われた
0	私愛されてるなあ。学校行ったか心配してくれる人までいる(棒読)
-1	@icchinakka 非モテ勢は厳しい
0	@icchinakka いや、モテるってめんどいらしいよ。わいみたいな性格ではたぶん耐えれんわ
0	寝れんよっと
0	@_reddhi さすが。女遊びが手慣れとる白は違うなあ
0	←暴言アカウント
0	@_reddhi バイト以外で女の子見た記憶ないぐらいな夏休みやで。馬の方がいっぱい見た気がするわ
1	@_reddhi バイトとかそう楽しいもんじゃないよ。年下の女の子とかに舐められとるし。
1	@_reddhi 違うよ。いやあ、なんか俺って言うことめちゃくちゃやし奇行多いやん
0	@_reddhi そう思っとるけど違うっぽい。というかたぶん京都に馴染めてないんじゃね
-1	@_reddhi あれやん。なんか俺うるさい奴とかまず嫌いやん。しかもなんかあんまり融和せんやん
1	@_reddhi たしかにうるさい奴多い気がせんでもないけど、オンオフできる人多いしなあ
1	RT @keibalab: 【RTでゴールドシップ・内田博幸騎手サイン入り写真が当たる！】「アンカツ降臨！ウラ話てんこ盛りのガチンコ！ニコ生競馬祭」　http://t.co/MWbPMZbOiC　いよいよ今晩に迫った競馬プログラムは超必見！このつぶやきをRTしてくれた方の中から…
0	今日の服は絶望的に配色センスがないが、誰も見てないしいいだろ
0	わんちゃん大学生いっぱいおるおる
0	というかわんちゃんって犬じゃないらしいな。この前聞いたら違うって言ってた
1	うぇーいwwwいっぱいおるなあ。今日も平和やで
1	黒髪が清楚だという時代は終わった、というかそもそも始まってないと思うけど
0	帰宅した。しばらく余裕ある
1	私のことを要領良いと言う人いるが、決してそんなことはない
1	セブンイレブンのちゃんねーが超絶かわいい気配の人だった
0	顔とか服装ではない。オーラが
0	ぁたし〜彼氏ぃない歴＝年齢だけどぉ、やっぱり彼氏ほしぃなっ*･゜ﾟ･*:.｡..｡.:*･’(*ﾟ▽ﾟ*)’･*:.｡. .｡.:*･゜ﾟ･*
0	キモいこと言うぐらいしかやることないなあ
1	ぶる速-VIP : 弟が勇気を出して告白したが２０万円支払うことになった http://t.co/mwxaB8nmux
0	釣りじゃなかったら死ぬ
1	好きでもないキモい奴に好かれるのって精神的苦痛か…私は誤っても人を好きになってはならんなあ
1	@popopo2525meen ジェットスターのお姉さんに聞けば万事解決。かわいいお姉ちゃんとも話せるし、無事に飛行機にも乗れる。良いことしかないが
0	@popopo2525meen わいお姉ちゃん好きやしその辺は知らんがなw
0	お姉ちゃんと遊びてえなあ(適当)
0	そういや今度私が実家帰った時に妹が友達連れてくるとか言ってたの思い出した。死にたい
0	わいロリ系は興味ないんよなあ
0	タイヤカバーをホームセンターに買いに行こう(提案)
1	慰謝料20万円とか冷静に考えて激震走る
0	まあ釣り釣り
-1	ひよこちゃんLINEスタンプマジで誰かいらんか。なんかもったいない
1	ひよこちゃん既読になった瞬間返信してくるお。LINE既読厨の人もこれで大丈夫だなwwwwww http://t.co/gnqhabJtjd
0	はよう
1	ライトニングロアーはデキ良いし逆転あればなあ
1	@ayachan522 おまえのかわいさも負けてないで(棒読)
0	とりあえず髪切ってきた
0	今日は微妙な調子やなあ
0	リア充の余裕というやつかこれは(適当)
0	クリサンセマムに関しては頭までは疑ってる
-1	たぶん俺チャラくないよね。チャラくないよね
0	私も大阪で腕時計買ってもらおう(小声)
-1	というのはまあ軽い冗談だが腕時計ほしい
1	マイネオーラムはデビュー前から目についたいい馬だね
1	ローブデソワは確か35000円とかで出資しようか迷った馬だったがやはり走るなあ
1	32000円かあ。いい馬
0	ワールンガ粘ってたら万馬券来る
1	粘ってなかったら30倍が無難に来る
0	あざーす
0	フラアンジェリコから買って不的中などという技を披露
0	オリービンかパワースポットかという選択を誤った
0	昨日の未来シアターでも見とくかあ
0	今回の髪型はまあまあ気に入ってる
0	酒飲んでる
0	もう少ししたらコンビニ行こう。チケット買わんと
0	前走260倍ドベ人気やった馬が、今回は1.7倍で1番人気になっとる
-1	買ったにも関わらず前走的中できなかったの本当に痛い
0	ヴェルデグリーンはウメノファイバーの孫かあ。わいも年取るはずだ
0	時間があるので孤独死について考えている
0	私が直面しそうな話題だしなあ
1	桐谷美玲ちゃんまあまあ可愛いと思う
0	昨日の夜ぐらいからFacebook開くと真っ先にお姉ちゃんの写真が現れ若干動揺するのだが
1	まあiPhoneから目玉の写真出てきた時よりは動揺せんが。さすがにこんなん突然現れたら冷静さ欠くわ http://t.co/f2768nqFfT
0	この他にも私のiPhoneの写真フォルダはわけのわからん写真で溢れとるなあ
0	@umauma2010 いってらー
1	リア充乙。しかしまだまだ私もおまえらには負けんよ
0	おはよう
1	船橋法典よろしいやん
0	行ったことねーし
0	豆腐買いに行こう
1	豆腐をレンジで温めたら湯豆腐みたいになるのマジだった
0	頭わいとる→九州新幹線の窓ガラス、酔客が消火器で破損（読売新聞） - Y!ニュース http://t.co/MQlsAHOSlr
1	開門ダッシュステークスにはテンの速さはもちろんのこと、ハイペースの中で上がりをまとめるという芸当も要求される
1	くじ運良いなあ。私は良くてターフィーショップ500円券
0	1Rはドリームノート推し
1	50倍のワイド買っとる。これはファインプレー
-1	3連複当てれとったなあ。昨日から買い方悪くてもう
0	@popopo2525meen これはぶり返すパティーン
1	ここも抑えのワイド的中。よろしいやん
0	さすが田辺や
0	わいの出資馬にも田辺J乗ってほしいぐらい評価している
0	ワンアンドオンリーがんばれー
0	今年の2歳馬の中で私の評価が一番高い馬
1	ワンアンドオンリー勝ったか。良かった
0	ダイワダルタニアンあざーす
0	暇なら競馬場でお姉ちゃん引っ掛けよう(提案)
0	サドンストーム超絶仕上げ
1	@ayachan522 @juhiro1 いやいや、東京とかマジ無難な感じで帰ったやろw
0	サッカー見に行く
0	負け戦に出兵するような気分
0	浜中ファインプレーで今開催もなんとかプラス収支で終了 http://t.co/w15foWGQo7
0	昨日の馬券組み立てミスが響いたなあ。取れる時に取っとかないと
0	@zemityo_abe はよこい
1	旅行は現地集合でやりたいね。あのわけわからんカオス感が結構好き
-1	さっきからガキンチョが歌うたいながら私のiPhoneの画面を後ろから覗き込んできたりしてなかなかめんどくさい
0	前半40分やけどまだワンチャンスもないんやけど
0	前半ラキ珍で1点も取られずに済んだ。あと45分の観戦
1	試合見よるよりガンバのお姉ちゃん見よる方が楽しい(棒読)
0	自分に対してもっとプレッシャーをかけていかないといけないなあ
0	明日は早起きせんといかんなあ
0	朝起こしてくれるという専属契約のお姉ちゃんとかを雇いたい
0	おはよう
0	とりあえず吉野家で朝ごはん食べてる
0	新幹線席空いてないし立ってる
1	@popopo2525meen わろた。俺新幹線やけど、自由席にしたら席なくて立ってる。隣にかわいらしいお姉ちゃんおるし、話しかけよかな(棒読)
-1	タイムライン上にはギリギリのところで戦っている方々がおる。人生攻めとるなあ
0	昼休みなんだけど、喫煙者の方がみんなタバコ吸いに行ってほぼぼっちみたいになってる
0	名古屋でそこそこ泥酔しとんやけど家まで帰れるんやろか
0	生中×8杯と梅酒ロックでまあ3000円はいっただろう。8杯以降は飲んだような飲んでないような感じで覚えてないけど
-1	グラス空いたら勝手にすぐに一杯につがれたビールがそこにはあった
1	もうちょっとお姉ちゃんと話せば良かったなあ。まあ十分か
1	@ooopsps まあ良い感じに酔った。無事に京都まで帰ってきた。あとは家まで帰れるかが焦点
0	しかし飲み会誘われて行ったが、「LINEのID教えて」とか言われても、「それ何って？」レベルの俺なんなんやろ？まあなんかQRコード読み取らせてもらって解決したけど
-1	とりあえずLINE難しいね。使わんしよくわからん
