-1	今日は非常に厳しい結果であるが、まあたまにはこういう日もないとな
0	ジョウノムサシとポメグラネイトをガッツリ買う
0	45000円ほど失ったわけであるが、まあ先行投資としては悪くなかったと思うね。人気落ちればさらに狙えるし、配当も大きくなるので期待が膨らみます
0	まあ今週はなかなか馬に回すほどの時間がなかったし、来週の土曜日が勝負ですね
1	リア充乙
0	楽天セールあざーす
0	RT @umauma2010: 日頃より、楽天市場をご利用いただきまして誠にありがとうございます。 現在、アクセス集中により一部の機能を制限してご提供させていただいております。
0	偽者クソワロタｗｗｗ
0	セイントメモリーとセイクリムズンのデキがよろしいやん。そしてドリームバレンチノは今日みたいな不良ダートは合いそうな馬
0	ソリタリーキングよろしいやん。実力足りるか怪しいけど
0	@umauma2010 forestですか？
0	@umauma2010 本当に私も文法はパッパラパーなので丹念に復習したいところです。TOEICのスコアをあと100点ほど上げたいのですが、道のりはなかなか険しそうです...
1	@umauma2010 「TOEIC TEST STANDARD 1800」っていう単語帳を使ってます。長文の中に頻出単語が出てくるタイプの単語帳なので良いかと思います。CD付きなのでスクリプトをシャドーイングしてリスニング対策なんかにも役立ちます。何か良い参考書御存知ですか？
0	@umauma2010 なるほど。DUOは私も持っていますが、辞書代わり的な使い方になってしまっています。TOEICTESTリーディングの鉄則は今度本屋さんに行った時にチェックしておこうと思います！
0	ねる
-1	@_reddhi 俺んちの実家の前の細い道も去年走りよったらしいで
0	柔らかみ厨
0	クリスマスプレゼントこれほしいなあ　http://t.co/eY4ecyCROp
-1	タクシーの危険運転はなんとかならんもんですかね
0	とりあえずあと60500円返ってくるわけか。500円は今日返ってきそう
0	しかし想定よりもお金が貯まってない
-1	不思議なもので1年というとは実に短い。こんなこと感じだしたのは今年からだが
1	reederが実に重宝する。PC版も早く新しいのが出ないものか。同期できるとさらに便利なだけに
0	友達いなかったので机で省エネスリープモード→ http://t.co/wXai1qTVzT
1	@_reddhi 本当にビッグになる奴は自分への投資を惜しまないもの
0	なんか煽っててわろたwwwまあ実際問題そうだと思うけど
1	前躯の可動域広そう
0	そろそろマシュマロ買って帰るか
1	@_reddhi 時計と財布は良いもの使うべきだと思う。時間とお金って自分を支える上で非常に大切ですよ
0	かく言う私は3万円ぐらいのほどほどな財布を使っていますが
0	ラキシスはサトノアラジンよりバネなさそう。というか兄弟と知ってなんか驚いた
0	姉弟の漢字違うな
1	もはや楽しいことすらないという感じでなかなか詰んでる
0	バルタン星人
-1	世というのは非常に不条理
0	この人本当に何者なんだろう(困惑)
1	ぶる速-VIP : 俺が女の子に告白した時の返事で打線組んだwwww http://t.co/SA7gezmQJL
0	TKG(＝卵かけごはん)は漬け卵に限る
0	さすがは競馬厨
0	ニーチェ＝厨二という言い換えができる
1	無論、私はニーチェ好きです
0	おはようございます
0	学校で「うぇーいｗｗｗ」とかってはしゃいでる人いるが、あれも一種の自己顕示欲みたいなものなのだろうか
0	あかん。間違えてLINEで和同開珎って送ってしまった
0	←オタクの人
1	こういうのもっと売りだせば良いのになあ。良いとこだと思うけど。http://t.co/WEdjNlbYPP
1	RT @umauma2010: 小さい頃の夢だった「魔法使い」が大人になった今実現し感動しています！夢は持ち続ける事が大事！(30歳・男性　スズカマンボ大好きパパ さん)
0	マシュマロに埋もれて死にたい
0	こたつとテレビを昨年処分したわいはキチガイ
0	やる気が出ません
0	本当に馬鹿げている
0	ゆるふわ系女子
1	卒業旅行でド派手に海外とか行くお金ないよね。みんななんで海外旅行とか行くお金あるんかよくわからんよなあ
0	それどころか私なんて来年乗る車も買えへんよ
0	私がシェアハウスとかしたら破門されるなあ
0	昨日も馬について熱弁してドン引きされたばかりだし
0	私ってひとりが板についてるからなあ
0	金と単位以外に女の子とかも人を動かすのでお忘れなく
1	サンタ帽のやついいなあ。俺もやろう
0	アイコンを[サンタ帽]でデコりました。 #iconDecotter http://t.co/xcDB21p8AF
0	ハンパないヤラセ臭が
0	なんかあいのりっぽい感じやな
0	頭の中で思い描いてる自分に全然追いつけてない
0	RT @umauma2010: 女「クリスマス予定ある…？///」 俺「あ、ありませんが…(ドキドキ」  女「バイトシフト入れときまーすwwwwwwwwwwwww」
1	好きな人でもいりゃあ人生少しは楽しいだろうなあ
0	本当に出会いというか女の子と話す機会、いやいや。そもそも人と話す機会すらもそんなにないからなあ
0	@zemityo_abe さすがは3股クズ芸人。笑
1	女の子と手とか繫ぐの良いんじゃあないのか。というかそんなことしたのいつが最後かわからんレベル
-1	よく「おまえが本当に非リアかどうかは疑わしい」とか言われるが、疑うまでもなく非リアです。人を見る目がないんですかね(小声)
0	なるほど。アパパネちゃんですね。そんな貴方は本日からこの病院に入院していただきます
0	まあ気持ちはわからんでもない。非リアもこじらせるとここまでくるわけよ
1	リア充乙
0	RT @umauma2010: 人を見る目がある方不可 馬を見る目がある方大歓迎！ 交通費支給
1	@ayachan522 ささやかながらクリスマスモデルです。ありがとうございます
0	@ayachan522 お褒めの言葉ありがとう(てへぺろ
-1	リア充を敵対したりはしてません。むしろ無策無能な自分に絶望しています
1	というよりもなんかあれよね。人に興味を持ちたいね。なんか人を好きになりたいね。
-1	本当に最近思うことはこれ。なんかもうすぐ自分の殻に閉じこもっちゃうし嫌だ
0	おはよう
-1	腰痛すぎわろたの範囲を超えてるのでそろそろ病院行こうか。もはや階段とか寝返りが若干つらい
-1	外出たら異様にしんどいことに気づいた。結構集中してたんだなあ、あのときは
1	テラスハウスにガチホモ系ぶっこんだらおもしろそう
0	テラスハウスとか言ったらライステラス思い出した
1	デニムアンドルビーは硬く映るなあ。なんか長くいい脚使うようなタイプな感じ
0	卒論忘れてさあ気を抜こうとか思ってたら「心理学専攻なんですけど、卒論の実験に協力していただけませんか」とか言われるからもう
0	RT @umauma2010: 先生「もうすぐ母の日なのでお母さんの似顔絵を書きましょう」 「あれ？◯◯くんお母さんを書きましょう、馬を書く時間じゃありません」 俺「遺伝です」
0	帰宅した
0	マシュマロ食べながら歌ってる
0	非リアウイルス
0	トリンドルちゃんこの人か。記憶
0	俺の友達、卒論できてなさすぎて頭わいとんやけど。LINEが来るけど明らかに発狂しとる
0	むしろなんか欲望がほしい
0	最近自分がわからんすぎてよくわからん
0	努力はだいたい報われないわけ
1	最近どうでもいいことばっか考えてる
0	どうやったら勝ち気になれるんだろね
0	学祭か。キョロ充湧いとんか
0	京王杯は当たったか。
-1	ファンタジーステークスはタイセイララバイの出遅れが痛かった
1	夢に私が出てくるとは私のこと大好きなんですねえ
0	非リア臭は滲み出るくね
0	ガチホモ勢
0	うぇーいｗｗｗ学祭だああああ
0	全く興味ねえよ
1	学祭で競馬中継垂れ流ししながら予想しつつソーセージ売るお店出店したらおもろそう
0	梅田から阪急ってたしか地下通ったら行けるでしょｗ
0	阪急梅田駅から大阪駅に向かう時のヨドバシカメラが見える歩道橋のことかなあ？
0	私の個性を打ち破り破壊する不思議ちゃん女の子なら彼女にしてやってもいい(棒読)
-1	無個性なやつ嫌いなの
0	イラレ厨
0	私も女の子と手とか繋いでデートでも行くかあ
0	うそです。むりです
0	わくわく！クリスマス(^^)
0	戯言
0	RT @umauma2010: 週刊「わくわくクリスマス」　初回500円
0	クリスマスにワクワクカンヲ
0	巧妙に小田切馬を登場させる
0	@_reddhi ただ単に自分の努力不足です。私が言えたことではないが
1	バルザローナはなんか当たりの強い乗り方だよなあとか思うのは私だけか
0	@_reddhi 自分に能力ないのってだいたい自分の慢心だよね。俺とか慢心ばっかやし
0	@_reddhi 夜は感情的になりやすい。ちょっと頭冷やして来い
1	@_reddhi 言う奴には言わしておけばいいと思うよ。俺は俺のやり方で成功するじゃないけど、時にはエゴも使わんとね
1	←おもしろキョロ充
0	頭がわき始めてきました
0	前からか
0	毎日夜12時ぐらいになると人生の懺悔を始めます。まあしかし気持ちは前向きです。苦しいですが
-1	@_reddhi 毎日つらいことしかないですね
-1	@ayachan522 ポッキーむしゃむしゃ食べるわ。チョコレートみたいに甘くないけど
1	どういう返し求めてるんですかねみたいなこと多いよね。最近。笑
0	@ayachan522 いや、別に嫌な気分じゃないしいいんよ。買って食うか
0	俺の気の利いたこと言えなさは異常
0	最近もうなんか考えすぎですね。はい
0	@_reddhi 特に謎なポイントないでしょうに
0	@ayachan522 どいうノリなんこれ。よくわからんなあ。笑
0	私ちゃんねーにそそのかされて明日ポッキー買うらしい
-1	などとつぶやくと「おまえのどこが非リアなんや」などと排斥されたりするので、世の中怖いなあと思いますね。笑
0	哲学ニュースnwk : お前らを勘違いさせた女の一言ｗｗｗｗｗ http://t.co/EeBw6pAyQo
0	勘違いしそうになるよね。本当
-1	今日も体がだるい
0	ポッキー買い行くか
0	お姉ちゃん、俺と一緒にポッキー買い行かね？⊂((・⊥・))⊃
0	きもすぎわろた
0	ポッキー買いに行ったのにポッキー買ってくるの忘れた
0	本末転倒とはこのこと
0	ガッキー劣化したという意見を見かけるが私はそうは思わない
0	夏休みわいも庭で七輪に火を起こしてひとりで焼肉した。要するに一緒に食う人いなかった→VIPPERな俺 : 【画像】1人焼肉なうwwww http://t.co/HqLrcnXwxC
0	バイト先で「彼氏彼女のクリスマスプレゼントどうしよう話」がされていて、私は迫真の演技で空気となった
0	結局ポッキー食わんかった
0	これはリア充っすわ
-1	まいまいなんかめんどくさい女感出てきたなあこりゃ
0	まあ女を見る目がない私が何か言える立場ではないが
0	大久保龍さんと角居さんとこはなんかそれっぽい馬だなあと見て思うことある。あとはよくわからん
0	女こええええええとか思って布団でぶるぶる震えよう
0	わくわく！クリスマス(^q^)2
0	わくわく！クリスマス(^ω^)3
0	わくわく！クリスマス(*^^*)4
0	わくわく！クリスマス(^L^)5
0	キチガイと思われそうやしやめとこう
0	今年のクリスマスは有馬記念で一山当ててひとりでドンペリ飲むかあ(適当)
0	はよう
-1	寒いです。やる気も出ません
0	今までの俺は生かされて生きてるだけだった。意志がなかった
0	何度も申し上げるが私はチートではないよ
-1	おまえら俺のこと過剰に信頼しすぎでしょうに
0	先日からの問い合わせ一覧 パソコンがウイルスに感染した イラストレーターの使い方がわからん エリザベス女王杯で来る馬教えろ iPhoneの画面割れた←NEW
0	@_reddhi めっちゃ鳴る。まあ興味ない奴は切り捨てるが
1	電話が珍しく鳴ると思ったら教えてほしいことがあると。最近こういうの多いですね
0	朝帰りのわい帰宅
-1	非常にしんどいので少し寝てから活動しよう
0	wow♪wow♪wow♪wow♪wwwwwwwwwwwww
0	うぇーいwwwwww
1	@ayachan522 洗濯物干すあやちゃん素敵かもしれんなあ。(適当)
0	最近「ば」と入力すると「ばんめしいぬ」という暗号が出てくる
0	@icchinakka ああわいの知り合いか
1	実におもしろい
0	どうしようと結局は自分の判断なんですよ。私はいっぱい失敗してきましたが
0	@icchinakka おまえどんな感じ？
0	@icchinakka なるほど。あと5秒か
-1	私は自分が嫌いです。あてにならないからです
0	金持ちすぎわろた
0	よおし。お父さん余興で馬体講義するぞお！
0	需要がない ↓
0	@popopo2525meen ノウハウ教えたくないのでやりたくないですね(棒読)
0	私、平和主義の鑑みたいな者なので、お友達と絶縁したりなどというそういったことは考えたこともやったこともありませんなあ。っと
0	まるでわいで笑った。なんか久しぶりにちゃんねーと遊びたいような気分になってきた→【2ch】コピペ情報局 : 【何故なのか】　恋愛しない男性が増加！！ http://t.co/eMPuJAomuH
1	古美門さんみたいな人間は好きですよ
0	ああ。あのイタリア料理店ね。お高くはないけど微妙だとか
1	私はいつものお店でカネロニ食べれればイタリア料理はそれでいいです
1	あっしーをどなたか買収してワインでも開けながら食べたいですね。さぞおいしいだろうに
-1	もう本当に実家のような片田舎に住んでると不便だよね。居住環境としては気に入ってるが。車とか乗るのめんどくせーし、誰か迎えに来てよから始まる
1	正月はケンタッキーに食べに行きがてら、袴を着た土着のヤンキーを見物しようと思います。彼らは実に興味深い
0	ボランティアでデートしてやってるとかって話が聞こえてきて私震える
-1	世の中怖すぎわろた。さらに殻に篭ります
0	組合の専務の人に電話したら「すまん、すまん。今日はお休みいただいて旅行中でしてね〜」だと。
1	非常に申し訳なかった。いやあ、しかしいい人なんでしょうね。資料の送付が遅くなって申し訳ございませんみたいな達筆で書かれた手紙が同封されてたし
-1	鍵を抜き忘れるとは不注意極まりないよね(小声)
1	ゼミで叩かれるどころか、なんかよろしいやんみたいな感じになってた
0	さすがに近ごろ追い込んだので今日は気が抜ける
0	そういや今日Skypeかかってきてたな。手が回らんくて出れんかったので、今日の夜あたり適当にかけとこう
0	ワイン買って帰って死ぬか
0	カベルネちゃんにしとこうか
0	ミニスカお姉ちゃんとか久しぶりに見た気がす
0	エキノコックス
0	煮沸
0	自分の頭を撫でましょう
1	テラスハウスはてっちゃんを温かく見守る番組
1	テラスハウスでの恋に連敗中のてっちゃんだが、私の25倍はリア充である。人を好きになることはすばらしい
0	@icchinakka どの辺がやw
1	人を好きになることで心が豊かになる人は多いようである。ただし私は違うが
0	ねえパパ〜梅田で合コンしまくってる人が合コン行ったことないとか言ってるよ(小声)
0	はっひふっへほーっと
0	悲しみの就寝するか
0	4万円ぐらいか
1	マイネルアダマス差しきってしまったかあ。2着ならさらに良かったがまあ3連複万馬券だし良いか
0	本日2本目の万馬券的中っと。今年18本目ぐらいかね
-1	しかしまあ今開催は回収率がまだまだ悪い。今日でなんとか70％といったところか。先週までなんて17％なんだからお話になりません
0	回転寿司来てますが回転しなくなりました
0	RT @Umaya_Daily: 東スポ杯2着のプレイアンドリアル・岡田総帥「高速馬場がどうかと思ったが、それでも勝てると思っていた。驚いている」とショックを隠しきれない様子でした…
1	高速馬場がどうかと思ったが、よく対応した。先々にめどが立つ内容で来年が楽しみ。ぐらいなコメントが無難なとこかと
0	万馬券きたあああああ。とか思ったらオッズめちゃくちゃ下がってた
1	バトルジェジェジェ割と良い馬だって昨日激震走ったよね。笑
0	地蔵勝ったか
1	今日は無難な的中が多いが、当たると楽しいし良いや
1	スリーカラーナンゴ良くやったあああああああ
0	今日はチチカステナンゴちゃんの子どもたちで稼げますなあ
0	チチカステナンゴも成功かと言われると微妙だが、駄馬とかいうレベルではないと思うが
1	馬券の買い方を3連複＋馬連orワイド、3連単＋3連複といろいろ試してるが、結局オッズや力関係見つつレースによって柔軟に買い方決めれると良いよなあ
0	出資馬の検討を開始する
0	まあトータル3頭ぐらいで
1	@popopo2525meen 大丈夫や。10枚買ったなら2700円は返ってくる
0	@popopo2525meen ちなみに返ってくるの300円や。間違えた。宝くじとかお金の無駄遣いでーす。笑
1	@popopo2525meen ああ、大丈夫。有馬記念ガッツリ買うから困ってない
-1	忘年会と同窓会の会費で軽く馬1頭出資できてつらい
0	@_zarkava 同じくかもしれないです
0	@_zarkava ウインもラフィアンもやめにしたんですか〜？
0	田辺裕信さんは小西厩舎の薬物検出騒動のショックで寝込んだか
1	アズマクィーン買えば良かったか
0	ザイディックメアから馬連、3連複買ったがアズマクィーンいなかった。距離長いかなあと思ったから切っちゃった
1	マルタカシクレノン今日は勝負気配あったから良かった。3連複馬連ごちそうさまです
0	@r_ino_ ありがとうございます！マルタカシクレノンから3連複12点で当たりました〜！
0	浜中でも100勝できるから要するに腕じゃない
0	RT @GodolphinA: 4月18日に結婚式を…と言われ、返信する前に「その日皐月賞じゃないかな…」とレーシングカレンダー見てしまうほどの人間です
-1	わかる。友達と遊んでる日に狙ってる馬出走とかすると密かにつらい
0	ノルマンディーから請求書来てた。グレイスフルワードのデイリー杯の配当が7着だったけど結構あって驚いた
1	RT @umauma2010: 無宗教って素晴らしい、ただ神は信じる。俺が神だ。
0	俺みたいなこと言ってる人おってワロタ
0	来年の2歳馬は2頭か3頭くらい出資したい。まあいい馬がいるかとお財布と相談してだが。
0	とりあえず重賞勝ったりできる馬に出資したいというよりは、コンスタントに走れる丈夫な馬に出資したい。あんまり出走できないと退屈しちゃう
1	ラフィアンの出資はどうするかなあ。ベーカバドってので完全に悩んでる。馬は良いが
-1	しかし昨日は泥酔してタクシーで高速道路使って帰宅というブルジョワみたいなことした。私の諭吉は儚い
0	明日も狙いたい馬がぼちぼちもうひと儲けするか
0	スノードラゴンに期待してる牧雄ちゃん http://t.co/LKtjSSpbzl
0	でもたしかに香港とかいけそうやな
0	揚げないササミカツを大量調理した。私は勝った http://t.co/sDZEL9t9lT
0	@r_ino_ おめでとうございました！
0	阪神6R ◉アドマイヤヤング ○バトルムーングロウ ▲バルトロメオ
1	石川よくやった
0	内田はアフォなのか
0	阪神JF ◎アルマオンディーナ ○レッツゴードンキ ▲ショウナンアデラ △トーセンラーク
-1	RT @umauma2010: 遅くなりました http://t.co/jEKMRfHiut
0	@umauma2010 ガチすぎワロタ。クオリティ高すぎじゃないですかw
0	しろ氏さんどんだけ給料もろてるねん
0	明日はジャズドリーム行く
0	アウトレットモール行くと調理器具買いたくなる症候群なんとかしたい
0	シップスかアローズで服買おう
0	長島のアウトレットモール来たので東南海地震来たらもれなく津波で死にます
0	などとつぶやくとまた叩かれる
0	タグホイヤーアウトレット見てこよう
0	靴買った。3諭吉バイバイ
0	買いすぎわろた http://t.co/PGJvDLY0AE
0	6諭吉逝った
0	外吹雪いとる。ちなみになんか家帰ってからエアコンぶっ壊れたので家の中でダウンジャケットとマフラー着用 http://t.co/qgYG8On0Le
0	雪降りすぎわろた http://t.co/J4d9rD6dPr
-1	@caerleon11 通勤がスリップしたりして大変でしたw
0	RT @saitamakita: 今月にパナマ運河で捕獲されたワニがでかすぎて驚愕、もしかすると世界最大のワニとしてギネス世界記録更新の可能性もあるとのこと http://t.co/FWivRL0L7c
-1	RT @g_glider0714: あまりに脆弱な越後線に米坂線のこの雄姿を見せたい http://t.co/ZvIkBKKGVi
0	@umauma2010 おめでとうございまーす( ^ω^ )
1	アクティブミノルはほんまにソエ焼きまくってるやん
-1	とりあえずエアコンぶっ壊れて死ぬほど寒い
0	RT @pentabutabu: 後輩女子の「スタバでは必ずトール以上を頼みます。大きなカップで飲んでると小顔に見えますから」という女子力あふれた発言に対し彼女いない歴＝年齢の後輩男子が「スタバのドリンクって牛丼並のカロリーらしいですから、そんなたくさん飲んでたら顔太りますよ」…
0	@kentatonbo クロネコならコンビニで受け取りたいわで終わり。
0	クラリティスカイとか勝負服まで同じだしアトムするだろ(適当)
1	血統の本読んでておもろいとは思うが全く頭に残らないので自分向きではないのだろう
1	飛節がー筋肉がー繋ぎがーと写真見ながらニヤニヤしてる方が楽しい
0	ポイント還元とか現金割引に大敗してるわ
0	マジでエアコン死んでるのがキツい。室温8度死ぬ
0	RT @umauma2010: 人は皆、ケーキ屋でバイトすれば彼女が出来る
-1	@malrin1D 中京行かれてるんですね！てか年齢一緒くらいかもですね。笑
0	@malrin1D あ、同じかもです！今年23歳ですか？
0	@malrin1D おおお( ^ω^ )今度ぜひ中京でお会いしましょう！笑
0	ジャポニカーラ軸だったけどサンヨーク抜け
0	ここは福永ジョッキーの公務員騎乗2着に期待
0	阪神7R ◎ショウナンガッチャ ○トランザムスター ▲シゲルエッチュウ
0	ショウナンガッチャはやっぱり来たか
0	今日の夜から京都行くが着いてからどうやって時間潰そうか
0	愛知杯 ◎スイートサルサ ○キャトルフィーユ ▲シャトーブランシュ △バウンスシャッセ
0	スイートサルサが3着なら当たりなんだがどうか
0	スイートサルサで頼む
0	リゲルS ◎コスモソーンパーク ○サクラアルディート ▲レッドアリオン △シャイニーホーク
1	愛知杯はスイートサルサから手広く流しといて良かった http://t.co/ZbL8aFVYu6
0	スリーアルテミス買わなあかん
0	おけw
0	3連複4点で当たった！やったぜ http://t.co/ZCh5AHLhWF
0	これも当たった http://t.co/M79dP5j36a
0	67倍も付くんか
-1	阪神12レースは難しそうだしやめとこ
0	まあ◎ガリバルディ○テーオーフェアリー
1	買わんで良かった展開。思ったのと違った
-1	馬場悪い日は結構当たるなあ
0	そろそろ支度せんといかんなあ
0	愛知杯のリプレイ見てから
0	いやあ、これは勝春よくやった
1	ツイッターでJRAに文句ばっか言ってる人なんなんだろ。自分で文句言いに行ったらいいのに
0	とりあえず今日の競馬で旅費は捻出したし気楽
